{
  "command": "test checkout.checkout_service.rejects_negative_total",
  "completed_at": "2026-05-16T11:04:30Z",
  "cwd": ".",
  "exit_code": 0,
  "kind": "proof_artifact",
  "output_bytes": 60,
  "output_path": "artifacts/unit-test.txt",
  "output_sha256": "6c7fa0177b468f5d7014580be2c31a581def53cc02ac41c74cfd50d1f62f029d",
  "schema_version": 1,
  "started_at": "2026-05-16T11:04:00Z",
  "status": "pass",
  "stdout_excerpt": "test checkout.checkout_service.rejects_negative_total: pass",
  "tool": "pytest"
}
